{
  "schema_version": "1.0",
  "workflow_id": "WF-org_demo_bravo-UNIT-0039",
  "stage": "prep",
  "agent_id": "prep-stub@0",
  "status": "completed",
  "verdict": "PASS",
  "confidence": null,
  "timestamp": "2026-10-04T18:37:05Z",
  "model": {
    "name": "csv-replay-stub",
    "version": "0",
    "provider": null,
    "calls": 0,
    "cost_usd": 0
  },
  "error": null,
  "next_step_recommendation": {
    "action": "continue",
    "reason": "stub replay of sample row; 0 failed check(s)"
  },
  "evidence": {
    "schema_version": "1.0",
    "record_id": "PRP-0039",
    "workflow_id": "WF-org_demo_bravo-UNIT-0039",
    "stage": "prep",
    "agent_id": "prep-stub@0",
    "subject": {
      "org_id": "org_demo_bravo",
      "subject_id": "UNIT-0039",
      "unit_id": "UNIT-0039",
      "unit_scope": "unit",
      "refs": {
        "work_order_id": "WO-3007",
        "fba_shipment_id": "FBA-DUMMY-103",
        "sku": "SKU-SERUM-30",
        "asin": "B0DUMMY031",
        "fnsku": "X00DUMMY039"
      }
    },
    "client_id": null,
    "status": "completed",
    "captured_at": "2026-06-02T16:55:00Z",
    "produced_at": "2026-10-04T18:37:05Z",
    "latency_ms": null,
    "operator_id": "op_chen",
    "model": {
      "name": "csv-replay-stub",
      "version": "0",
      "provider": null,
      "calls": 0,
      "cost_usd": 0
    },
    "inputs": [
      {
        "ref": "fixtures/prep/UNIT-0039_front.jpg",
        "sha256": null,
        "kind": "image"
      },
      {
        "ref": "fixtures/prep/UNIT-0039_back.jpg",
        "sha256": null,
        "kind": "image"
      },
      {
        "ref": "fixtures/prep/UNIT-0039_label.jpg",
        "sha256": null,
        "kind": "image"
      }
    ],
    "checks": [
      {
        "check_key": "polybag_sealed",
        "verdict": "PASS",
        "confidence": null,
        "expected": "yes",
        "observed": "yes",
        "evidence_refs": [
          "fixtures/prep/UNIT-0039_front.jpg",
          "fixtures/prep/UNIT-0039_back.jpg",
          "fixtures/prep/UNIT-0039_label.jpg"
        ]
      },
      {
        "check_key": "suffocation_warning",
        "verdict": "PASS",
        "confidence": null,
        "expected": "legible",
        "observed": "legible",
        "evidence_refs": [
          "fixtures/prep/UNIT-0039_front.jpg",
          "fixtures/prep/UNIT-0039_back.jpg",
          "fixtures/prep/UNIT-0039_label.jpg"
        ]
      },
      {
        "check_key": "fnsku_label_placement",
        "verdict": "PASS",
        "confidence": null,
        "expected": "flat",
        "observed": "flat",
        "evidence_refs": [
          "fixtures/prep/UNIT-0039_front.jpg",
          "fixtures/prep/UNIT-0039_back.jpg",
          "fixtures/prep/UNIT-0039_label.jpg"
        ]
      },
      {
        "check_key": "original_barcode_covered",
        "verdict": "PASS",
        "confidence": null,
        "expected": "yes",
        "observed": "yes",
        "evidence_refs": [
          "fixtures/prep/UNIT-0039_front.jpg",
          "fixtures/prep/UNIT-0039_back.jpg",
          "fixtures/prep/UNIT-0039_label.jpg"
        ]
      },
      {
        "check_key": "expiry_legible",
        "verdict": "PASS",
        "confidence": null,
        "expected": "legible",
        "observed": "legible",
        "evidence_refs": [
          "fixtures/prep/UNIT-0039_front.jpg",
          "fixtures/prep/UNIT-0039_back.jpg",
          "fixtures/prep/UNIT-0039_label.jpg"
        ]
      },
      {
        "check_key": "handling_marks",
        "verdict": "PASS",
        "confidence": null,
        "expected": "all_present",
        "observed": "all_present",
        "evidence_refs": [
          "fixtures/prep/UNIT-0039_front.jpg",
          "fixtures/prep/UNIT-0039_back.jpg",
          "fixtures/prep/UNIT-0039_label.jpg"
        ]
      }
    ],
    "decision": {
      "verdict": "PASS",
      "outcome": "compliant",
      "confidence": null,
      "reason": "stub replay of sample row; 0 failed check(s)",
      "needs_human": false
    },
    "payload": {
      "prep_price_usd": 0.75,
      "measurements": null
    },
    "upstream_refs": [
      "RCV-0039"
    ],
    "overrides": [],
    "error": null,
    "content_hash": "72d43056778c8b607a5e71b19151563260fce867e637b94827b46763a04c5a8c"
  }
}
