{
  "schema_version": "1.0",
  "workflow_id": "WF-org_demo_bravo-UNIT-0039",
  "stage": "returns",
  "agent_id": "returns-stub@0",
  "status": "completed",
  "verdict": "PASS",
  "confidence": null,
  "timestamp": "2026-10-04T18:37:05Z",
  "model": {
    "name": "csv-replay-stub",
    "version": "0",
    "provider": null,
    "calls": 0,
    "cost_usd": 0
  },
  "error": null,
  "next_step_recommendation": {
    "action": "continue",
    "reason": "stub replay: disposition copied from the operator column, not decided by an agent"
  },
  "evidence": {
    "schema_version": "1.0",
    "record_id": "RTN-0039",
    "workflow_id": "WF-org_demo_bravo-UNIT-0039",
    "stage": "returns",
    "agent_id": "returns-stub@0",
    "subject": {
      "org_id": "org_demo_bravo",
      "subject_id": "UNIT-0039",
      "unit_id": "UNIT-0039",
      "unit_scope": "unit",
      "refs": {
        "order_id": "ORD-DUMMY-50039",
        "sku": "SKU-SERUM-30",
        "asin": "B0DUMMY031"
      }
    },
    "client_id": null,
    "status": "completed",
    "captured_at": "2026-07-08T16:55:00Z",
    "produced_at": "2026-10-04T18:37:05Z",
    "latency_ms": null,
    "operator_id": "op_amira",
    "model": {
      "name": "csv-replay-stub",
      "version": "0",
      "provider": null,
      "calls": 0,
      "cost_usd": 0
    },
    "inputs": [
      {
        "ref": "fixtures/returns/UNIT-0039_1.jpg",
        "sha256": null,
        "kind": "image"
      },
      {
        "ref": "fixtures/returns/UNIT-0039_2.jpg",
        "sha256": null,
        "kind": "image"
      },
      {
        "ref": "fixtures/returns/UNIT-0039_3.jpg",
        "sha256": null,
        "kind": "image"
      }
    ],
    "checks": [
      {
        "check_key": "identity_match",
        "verdict": "PASS",
        "confidence": null,
        "expected": "SKU-SERUM-30",
        "observed": "yes",
        "evidence_refs": [
          "fixtures/returns/UNIT-0039_1.jpg",
          "fixtures/returns/UNIT-0039_2.jpg",
          "fixtures/returns/UNIT-0039_3.jpg"
        ]
      },
      {
        "check_key": "completeness",
        "verdict": "PASS",
        "confidence": null,
        "expected": [
          "bottle",
          "dropper",
          "leaflet"
        ],
        "observed": {
          "missing": []
        },
        "evidence_refs": [
          "fixtures/returns/UNIT-0039_1.jpg",
          "fixtures/returns/UNIT-0039_2.jpg",
          "fixtures/returns/UNIT-0039_3.jpg"
        ]
      }
    ],
    "decision": {
      "verdict": "PASS",
      "outcome": "liquidate",
      "confidence": null,
      "reason": "stub replay: disposition copied from the operator column, not decided by an agent",
      "needs_human": false
    },
    "payload": {
      "observed_state": "damaged",
      "condition_graded": false,
      "amazon_condition": null,
      "sent_contents_seen": false
    },
    "upstream_refs": [
      "RCV-0039",
      "PRP-0039"
    ],
    "overrides": [],
    "error": null,
    "content_hash": "3f89b88776e7567955447f964bf18529f852dccd0677a5475a5b2c3f589d26ae"
  }
}
