{
  "schema_version": "1.0",
  "workflow_id": "WF-org_demo_alpha-UNIT-0014",
  "stage": "recovery",
  "agent_id": "recovery-stub@0",
  "status": "completed",
  "verdict": "FAIL",
  "confidence": null,
  "timestamp": "2026-10-04T18:37:05Z",
  "model": {
    "name": "csv-replay-stub",
    "version": "0",
    "provider": null,
    "calls": 0,
    "cost_usd": 0
  },
  "error": null,
  "next_step_recommendation": {
    "action": "complete",
    "reason": "stub: 4 charge(s), 1 contradicted"
  },
  "evidence": {
    "schema_version": "1.0",
    "record_id": "RCY-UNIT-0014",
    "workflow_id": "WF-org_demo_alpha-UNIT-0014",
    "stage": "recovery",
    "agent_id": "recovery-stub@0",
    "subject": {
      "org_id": "org_demo_alpha",
      "subject_id": "UNIT-0014",
      "unit_id": "UNIT-0014",
      "unit_scope": "unit",
      "refs": {}
    },
    "client_id": null,
    "status": "completed",
    "captured_at": "2026-07-18T00:00:00Z",
    "produced_at": "2026-10-04T18:37:05Z",
    "latency_ms": null,
    "operator_id": null,
    "model": {
      "name": "csv-replay-stub",
      "version": "0",
      "provider": null,
      "calls": 0,
      "cost_usd": 0
    },
    "inputs": [],
    "checks": [
      {
        "check_key": "charge_fee_0014_1",
        "verdict": "FAIL",
        "confidence": null,
        "expected": "charge supported by evidence",
        "observed": "CONTRADICTS",
        "detail": "Prep evidence shows the unit compliant",
        "evidence_refs": [
          "PRP-0014"
        ]
      },
      {
        "check_key": "charge_fee_0014_2",
        "verdict": "UNCERTAIN",
        "confidence": null,
        "expected": "charge supported by evidence",
        "observed": "SILENT",
        "detail": "receiving shortfall is supplier-side, not channel-side loss (finding F-10)",
        "uncertain_reason": "insufficient_evidence"
      },
      {
        "check_key": "charge_fee_0014_3",
        "verdict": "UNCERTAIN",
        "confidence": null,
        "expected": "charge supported by evidence",
        "observed": "SILENT",
        "detail": "no measured weight/dimensions upstream (finding F-07)",
        "uncertain_reason": "insufficient_evidence"
      },
      {
        "check_key": "charge_fee_0014_4",
        "verdict": "UNCERTAIN",
        "confidence": null,
        "expected": "charge supported by evidence",
        "observed": "SILENT",
        "detail": "amount is 0.00: nothing to claim, or the amount is missing (finding F-09)",
        "evidence_refs": [
          "RTN-0014"
        ],
        "uncertain_reason": "insufficient_evidence"
      }
    ],
    "decision": {
      "verdict": "FAIL",
      "outcome": "claim_recommended",
      "confidence": null,
      "reason": "stub: 4 charge(s), 1 contradicted",
      "needs_human": false
    },
    "payload": {
      "charges": [
        {
          "line_id": "FEE-0014-1",
          "charge_type": "inbound_defect_fee",
          "amount_usd": 2.0,
          "position": "CONTRADICTS",
          "reason": "Prep evidence shows the unit compliant",
          "evidence_record_ids": [
            "PRP-0014"
          ]
        },
        {
          "line_id": "FEE-0014-2",
          "charge_type": "lost_inbound",
          "amount_usd": 0.0,
          "position": "SILENT",
          "reason": "receiving shortfall is supplier-side, not channel-side loss (finding F-10)",
          "evidence_record_ids": []
        },
        {
          "line_id": "FEE-0014-3",
          "charge_type": "fulfilment_fee_weight_tier",
          "amount_usd": 4.75,
          "position": "SILENT",
          "reason": "no measured weight/dimensions upstream (finding F-07)",
          "evidence_record_ids": []
        },
        {
          "line_id": "FEE-0014-4",
          "charge_type": "refund_issued_item_not_returned",
          "amount_usd": 0.0,
          "position": "SILENT",
          "reason": "amount is 0.00: nothing to claim, or the amount is missing (finding F-09)",
          "evidence_record_ids": [
            "RTN-0014"
          ]
        }
      ],
      "claimable_usd": 2.0,
      "unclaimable": [
        {
          "line_id": "FEE-0014-2",
          "charge_type": "lost_inbound",
          "amount_usd": 0.0,
          "position": "SILENT",
          "reason": "receiving shortfall is supplier-side, not channel-side loss (finding F-10)",
          "evidence_record_ids": []
        },
        {
          "line_id": "FEE-0014-3",
          "charge_type": "fulfilment_fee_weight_tier",
          "amount_usd": 4.75,
          "position": "SILENT",
          "reason": "no measured weight/dimensions upstream (finding F-07)",
          "evidence_record_ids": []
        },
        {
          "line_id": "FEE-0014-4",
          "charge_type": "refund_issued_item_not_returned",
          "amount_usd": 0.0,
          "position": "SILENT",
          "reason": "amount is 0.00: nothing to claim, or the amount is missing (finding F-09)",
          "evidence_record_ids": [
            "RTN-0014"
          ]
        }
      ]
    },
    "upstream_refs": [
      "RCV-0014",
      "PRP-0014",
      "RTN-0014"
    ],
    "overrides": [],
    "error": null,
    "content_hash": "40e46cc8f2355ec9d4082c422dbdff895d7323d94d71633e046cc30df70dea92"
  }
}
